{
  "asset_id": "YOUR_ASSET_ID",
  "name": "Splunk SIEM（模板）资产",
  "asset_type": "waf_alert",
  "domain": "D1",
  "owner_team": "security-ops",
  "environment": "production",
  "status": "discovery",
  "connector_id": "YOUR_CONN_ID",
  "description": "Splunk 搜索模板；live fetch 需要 Splunk management API token。",
  "coverage": {
    "zones": [
      "edge"
    ],
    "apps": [],
    "hosts": [
      "YOUR_HOST"
    ]
  },
  "schema": {
    "fields": [
      "timestamp",
      "host",
      "user",
      "src_ip",
      "action"
    ],
    "time_field": "timestamp",
    "retention_days": 30
  },
  "query_template_ids": [
    "YOUR_TEMPLATE_ID"
  ],
  "field_aliases": {},
  "tags": [
    "template",
    "splunk",
    "siem"
  ]
}
